{
  "$schema": "../schemas/site-manifest.schema.json",
  "schemaVersion": "1.0.0",
  "project": {
    "canonicalName": "Crypto Agility Algorithm Protocol",
    "abbreviation": "CAAP",
    "interfaceName": "Common Crypto API",
    "repository": "common-crypto-api-caap"
  },
  "status": "reviewed",
  "sourceCommit": "1b8ff53246a1e9452e4757c8391b1c5c00728f71",
  "review": {
    "reviewedBy": "Ganesh Mallaya",
    "reviewedAt": "2026-08-04T07:26:52Z"
  },
  "targets": [
    "/research/",
    "/research/crypto-agility-algorithm-protocol/"
  ],
  "files": [
    {
      "path": "site-summary.md",
      "contentSha256": "7904eea59dd3ff663e1a5c69f354b84231d69dc43dc4352146418dd373aba471"
    }
  ]
}
